{
  "manifestId": "CLTAV-HISTORICAL-CAPTURES",
  "manifestVersion": "1.0",
  "purpose": "EXPLORATORY-DEVELOPMENT-ONLY",
  "captureCount": 23,
  "truthBoundary": "File annotation is not wire outcome, independent case conclusion, or experimental truth; topology, clock, configuration, version and root cause are UNKNOWN unless separately evidenced.",
  "captures": [
    {"captureId":"HC-01","relativePath":"OHMS数据加载CPM_L1_ACT40-FCPA-38AH,报fail,260820.pcapng","byteCount":214877828,"sha256":"0e9c160dc28f59502730e7bd860a69d095ed32671d761843bbadb18199cf103c","observationQuality":"UNASSESSED-EXPLORATORY","labelSource":"FILE-ANNOTATION-NONTRUTH","rootCause":"UNKNOWN"},
    {"captureId":"HC-02","relativePath":"OHMS数据加载CPM_L1全部驻留应用批量加载,报invalid_2,260820.pcapng","byteCount":679031144,"sha256":"e7229c92ccef0770a668641d918a83819b2c565ddfe451483b27862087a24bed","observationQuality":"UNASSESSED-EXPLORATORY","labelSource":"FILE-ANNOTATION-NONTRUTH","rootCause":"UNKNOWN"},
    {"captureId":"HC-03","relativePath":"OHMS数据加载CPM_L1全部驻留应用批量加载,报invalid,260820.pcapng","byteCount":576356708,"sha256":"eee8167081c08abd407ba810c37c13eba324c8e2109f25e3b2f4f8d820ca362c","observationQuality":"UNASSESSED-EXPLORATORY","labelSource":"FILE-ANNOTATION-NONTRUTH","rootCause":"UNKNOWN"},
    {"captureId":"HC-04","relativePath":"OHMS数据加载CPM_L1驻留应用批量加载,剔除38AH后成功,260820.pcapng","byteCount":374910832,"sha256":"f7d496f702f90f071bb8878dc1c4c15dc9c74a84e4f8668c868e843a6399957a","observationQuality":"UNASSESSED-EXPLORATORY","labelSource":"FILE-ANNOTATION-NONTRUTH","rootCause":"UNKNOWN"},
    {"captureId":"HC-05","relativePath":"OHMS数据加载CPM_L3全部驻留应用批量加载,报fail,260820.pcapng","byteCount":330008316,"sha256":"9313c38d56522512071cb06641f26302a34503bc5d2434c4f52836510b3b45b9","observationQuality":"UNASSESSED-EXPLORATORY","labelSource":"FILE-ANNOTATION-NONTRUTH","rootCause":"UNKNOWN"},
    {"captureId":"HC-06","relativePath":"OHMS数据加载CPM_L3单独加载ACT5C-F02D-11AK成功,260820.pcapng","byteCount":168481096,"sha256":"02acb13863b345332667099e929aa8851fff1c4a7f77ac0f9ae5bf0b246a2fc6","observationQuality":"UNASSESSED-EXPLORATORY","labelSource":"FILE-ANNOTATION-NONTRUTH","rootCause":"UNKNOWN"},
    {"captureId":"HC-07","relativePath":"OHMS数据加载CPM_r3全部驻留应用批量加载,报fail,260821.pcapng","byteCount":219204092,"sha256":"8bd6238c7e43998e51839e0a21bd63eef06e7dd23dbda2e2d04294aef80a0d7b","observationQuality":"UNASSESSED-EXPLORATORY","labelSource":"FILE-ANNOTATION-NONTRUTH","rootCause":"UNKNOWN"},
    {"captureId":"HC-08","relativePath":"OHMS机载数据加载RDCU01失败，返回no response.pcapng","byteCount":21038368,"sha256":"670fc9518cf8d4da12ccef3928c47bfa4a6a0539732c5c6e74a98be68b160996","observationQuality":"UNASSESSED-EXPLORATORY","labelSource":"FILE-ANNOTATION-NONTRUTH","rootCause":"UNKNOWN"},
    {"captureId":"HC-09","relativePath":"OHMS机载数据加载RDCU04失败，返回no response，数据包还在走但是已经报no response.pcapng","byteCount":64862104,"sha256":"21c1a002a15561409247d40db6f765a4cd793ac05e6c3c65686537c2d5d0fda7","observationQuality":"UNASSESSED-EXPLORATORY","labelSource":"FILE-ANNOTATION-NONTRUTH","rootCause":"UNKNOWN"},
    {"captureId":"HC-10","relativePath":"OHMS机载界面批量数据加载IDU_RIB,报invalid,260820.pcapng","byteCount":436375784,"sha256":"4f86874f7d324672540404dae942935cfbd75e2e79d74384cc7cb37f267c0e1e","observationQuality":"UNASSESSED-EXPLORATORY","labelSource":"FILE-ANNOTATION-NONTRUTH","rootCause":"UNKNOWN"},
    {"captureId":"HC-11","relativePath":"OHMS机载界面数据加载SAV49-F01B-02AK,报fail,260820.pcapng","byteCount":133821784,"sha256":"d391329e7a410d50d207b2b15b0fed2f9eabfd128adbe3a2e0e6e373ac51dd2e","observationQuality":"UNASSESSED-EXPLORATORY","labelSource":"FILE-ANNOTATION-NONTRUTH","rootCause":"UNKNOWN"},
    {"captureId":"HC-12","relativePath":"RDCU15_RSU2A抓包.pcapng","byteCount":7724,"sha256":"88b52e9f2013b5d8e6fb8fa9cd1555a6075635e494e216acac98906f61df45eb","observationQuality":"UNASSESSED-EXPLORATORY","labelSource":"FILE-ANNOTATION-NONTRUTH","rootCause":"UNKNOWN"},
    {"captureId":"HC-13","relativePath":"数据加载RDCU03失败，返回no response,AHMU侧抓包.pcapng","byteCount":268426660,"sha256":"dacd11b023d13dcc7648f6cd1c784007a63bfaaaf673c1667dfa673f73e8b27e","observationQuality":"UNASSESSED-EXPLORATORY","labelSource":"FILE-ANNOTATION-NONTRUTH","rootCause":"UNKNOWN"},
    {"captureId":"HC-14","relativePath":"数据加载RDCU03失败，返回no response,RDCU侧抓包.pcapng","byteCount":13655756,"sha256":"d1b3c05c1ac720aaa284c7d262c1351fca4b7b6f4f3ffc5958cc2973dc68e0ad","observationQuality":"UNASSESSED-EXPLORATORY","labelSource":"FILE-ANNOTATION-NONTRUTH","rootCause":"UNKNOWN"},
    {"captureId":"HC-15","relativePath":"数据加载RDCU03失败，返回no response,直连抓包.pcapng","byteCount":131212,"sha256":"66f2e1645fe43aa6538465990f53ea04e782c66dabc79d9f88b6147b952b346e","observationQuality":"UNASSESSED-EXPLORATORY","labelSource":"FILE-ANNOTATION-NONTRUTH","rootCause":"UNKNOWN"},
    {"captureId":"HC-16","relativePath":"数据加载RDCU09失败，返回no response.pcapng","byteCount":29365644,"sha256":"69cf870040e134eebcfbb7d267c81385e7632760c62d1548b7c12f8ce231e29d","observationQuality":"UNASSESSED-EXPLORATORY","labelSource":"FILE-ANNOTATION-NONTRUTH","rootCause":"UNKNOWN"},
    {"captureId":"HC-17","relativePath":"数据加载RDCU10失败，返回no response.pcapng","byteCount":25000024,"sha256":"fa9188bf975bdb9525d66369697df47dae9a4af6c6a912ae6732638b25f86758","observationQuality":"UNASSESSED-EXPLORATORY","labelSource":"FILE-ANNOTATION-NONTRUTH","rootCause":"UNKNOWN"},
    {"captureId":"HC-18","relativePath":"数据加载RDCU11失败，返回no response，在限制态但实验环境中Pmr为非限.pcapng","byteCount":39963964,"sha256":"bbf5473856ff37f4c0d70158a4e0e279c8ea0b60c4601ce8980f1a10b3462750","observationQuality":"UNASSESSED-EXPLORATORY","labelSource":"FILE-ANNOTATION-NONTRUTH","rootCause":"UNKNOWN"},
    {"captureId":"HC-19","relativePath":"数据加载RDCU12失败，返回no response.pcapng","byteCount":28362004,"sha256":"26fc3b5535648e585bc93bf21a3d485174c46d6f42c46860b52d6d0e59bc7488","observationQuality":"UNASSESSED-EXPLORATORY","labelSource":"FILE-ANNOTATION-NONTRUTH","rootCause":"UNKNOWN"},
    {"captureId":"HC-20","relativePath":"数据加载RDCU13失败，返回no response.pcapng","byteCount":33027660,"sha256":"16042b54f050e757130002abb0ed31e17f4922bd2ad87c05f55c0a31c002acef","observationQuality":"UNASSESSED-EXPLORATORY","labelSource":"FILE-ANNOTATION-NONTRUTH","rootCause":"UNKNOWN"},
    {"captureId":"HC-21","relativePath":"数据加载RDCU14失败，返回no response.pcapng","byteCount":24477248,"sha256":"277bcf1f27a19294d92632d90f70f5de9c4231ebd50db3a39b50473c1546b7c6","observationQuality":"UNASSESSED-EXPLORATORY","labelSource":"FILE-ANNOTATION-NONTRUTH","rootCause":"UNKNOWN"},
    {"captureId":"HC-22","relativePath":"数据加载RDCU15失败，返回no response.pcapng","byteCount":34484888,"sha256":"d3f903f9d3fca152aeacbb3f46a9f154905bf7679d025ff7a244c7ca7aac4742","observationQuality":"UNASSESSED-EXPLORATORY","labelSource":"FILE-ANNOTATION-NONTRUTH","rootCause":"UNKNOWN"},
    {"captureId":"HC-23","relativePath":"数据加载RDCU16失败，返回no response.pcapng","byteCount":34776268,"sha256":"690cd655486d861839ab7e84616fef8e8339e4f6158d2f52637eb5b780e76764","observationQuality":"UNASSESSED-EXPLORATORY","labelSource":"FILE-ANNOTATION-NONTRUTH","rootCause":"UNKNOWN"}
  ]
}
